verse_no,verse
9:13:,"Verily the Mahatmas, O Partha, partaking of My divine nature, worship with unwavering mind, having known Me, the imperishable source of beings."
9:14:,"Always magnifying Me, strenuous, in vows, prostrating themselves before Me, they worship Me with devotion, ever harmonised."
9:15:,"Others also, sacrificing with the sacrifice of wisdom, worship Me as the One and the Manifold everywhere present."
9:16:,I the oblation; I the sacrifice; I the ancestral offering; I the fire-giving herb; the mantram I; I also the butter; I the fire; the burnt-offering I.
9:17:,"I the Father of this universe, the Mother, the Supporter, the Grandsire, the Holy One to be known, the Word of Power, and also the Rik, Sama, and Yajur,"
9:18:,"The Path, Husband, Lord, Witness, Abode, Shelter, Lover, Origin, Dissolution, Foundation, Treasure-house, Seed imperishable."
9:19:,"I give heat; I hold back and send forth the rain; immortality and also death, being and non-being am I, Arjuna."
9:20:,"The knowers of the three, the Soma-drinkers, the purified from sin, worshipping Me with sacrifice, pray of Me the way to heaven; they, ascending to the holy world of the Ruler of the Shining Ones, eat in heaven the divine feasts of the Shining Ones."
9:21:,"They, having enjoyed the spacious heaven world, their holiness withered, come back to this world of death. Following the virtues enjoined by the three, desiring desires, obtain the transitory."
9:22:,"To those men who worship Me alone thinking of no other, to those ever harmonious, I bring full security."
9:23:,"Even the devotees of other Shining Ones, who worship full of faith, they also worship Me, O son of Kunti, though contrary to the ancient rule."
9:24:,"I am indeed the enjoyer of all sacrifices and also the Lord, but they know Me not in Essence, and hence they fall."
9:25:,They who worship the Shining Ones go to the Shining Ones; to the Ancestors go the Ancestor-worshippers; to the Elementals go those who sacrifice to Elementals; but My worshippers come unto Me.
9:26:,"He who offereth to Me with devotion a leaf, a flower, a fruit, water, that I accept from the striving self, offered as it is with devotion."
9:27:,"Whatsoever thou doest, whatsoever thou eatest, whatsoever thou offerest, whatsoever thou givest, whatsoever thou doest of austerity, O Kaunteya, do thou that as an offering unto Me."
9:28:,"Thus shalt thou be liberated from the bonds of action, yielding good and evil fruits; thyself harmonised by the yoga of renunciation, thou shalt come unto Me when set free."
9:29:,"The same am I to all beings; there is none hateful to Me nor dear. They verily who worship Me with devotion, they are in Me, and I also in them."
9:30:,"Even if the most sinful worship Me, with undivided heart, he too must be accounted righteous, for he hath rightly resolved;"
9:31:,"Speedily he becometh dutiful and goeth to eternal peace, O Kaunteya, know thou for certain that My devotee perisheth never."
9:32:,"They who take refuge with Me, O Partha, though of the womb of sin, women, Vaishyas, even Shudras, they also tread the highest path."
9:33:,"How much rather then holy Brahmanas and devoted royal saints; having obtained this transient joyless world, worship thou Me."
9:34:,"On Me fix thy mind; be devoted to Me; sacrifice to Me; prostrate thyself before Me; harmonised thus in the Self, thou shalt come unto Me, having Me as thy supreme goal."
10:1:,"The Blessed Lord said: Again, O mighty-armed, hear thou My supreme word, that, desiring thy welfare, I will declare to thee who art beloved."
10:2:,"The multitude of the Shining Ones, or the great Rishis, know not my forthcoming, for I am the beginning of all the Shining Ones and the great Rishis."
10:3:,"He who knoweth Me, unborn, beginningless, the great Lord of the world, he, among mortals without delusion, is liberated from all sin."
10:4:,"Reason, wisdom, non-illusion, forgiveness, truth, self-restraint, calmness, pleasure, pain, existence, non-existence, fear, and also courage,"
10:5:,"Harmlessness, equanimity, content, austerity, almsgiving, fame and obloquy are the various characteristics of beings issuing from Me."
10:6:,"The seven great Rishis, the ancient Four, and also the Manus, were born of My nature and mind; of them this race was generated."
10:7:,"He who knows in essence that sovereignty and yoga of Mine, he is harmonised by unfaltering yoga; there is no doubt thereof."
10:8:,"I am the Generator of all; all evolves from Me; understanding thus, the wise adore Me in rapt emotion."
10:9:,"Mindful of Me, their life hidden in Me, illumining each other, ever conversing about Me, they are content and joyful."
10:10:,"To these, ever harmonious, worshipping in love, I give the yoga of discrimination by which they come unto Me."
10:11:,"Out of pure compassion for them, dwelling within their Self, I destroy the ignorance-born darkness by the shining lamp of wisdom."
10:12:,"Arjuna said: Thou art the supreme Eternal, the supreme Abode, the supreme Purity, eternal divine man, primeval Deity, unborn, the Lord!"
10:13:,"All the Rishis have thus acclaimed Thee, as also the divine Rishi, Narada; so Asita, Devala, and Vyasa; and now Thou Thyself tellest it me."
10:14:,"All this I believe true that Thou sayest to me, O Keshava. Thy manifestation, O Blessed Lord, neither Shining Ones nor Danavas comprehend."
10:15:,"Thyself indeed knowest Thyself by Thyself, O Purushottama! Source of beings, Lord of beings, Shining One of Shining Ones, Ruler of the world!"
10:16:,"Deign to tell without reserve of Thine own divine glories, by which glories Thou remainest pervading these worlds."
10:17:,"How may I know thee, O Yogi, by constant meditation? In what, in what aspects art Thou to be thought of by me, O blessed Lord?"
10:18:,"In detail tell me again of Thy yoga and glory, O Janardana; for me there is never satiety in hearing thy life-giving words."
10:19:,"The Blessed Lord said: Blessed be thou! I will declare to thee My divine glory by its chief characteristics, O best of the Kurus; there is no end to details of Me."
10:20:,"I, O Gudakesha, am the Self, seated in the heart of all beings; I am the beginning, the middle, and also the end of all beings."
10:21:,Of the Adityas I am Vishnu; of radiances the glorious sun; I am Marichi of the Maruts; of the asterisms the Moon am I.
10:22:,Of the Vedas I am the Sama-Veda; I am Vasava of the Shining Ones; and of the senses I am the mind; I am of living beings the intelligence.
10:23:,And of the Rudras Shankara am I; Vittesha of the Yakshas and Rakshasas; and of the Vasus I am Pavaka; Meru of high mountains am I.
10:24:,"And know Me, O Partha, of household priests the chief, Brihaspati; of generals I am Skanda; of lakes I am the ocean."
10:25:,Of the great Rishis Bhrigu; of speech I am the one syllable; of sacrifices I am the sacrifice of silent repetitions; of immovable things the Himalaya.
10:26:,Asvattha of all trees; and of divine Rishis Narada; of Gandharvas Chitraratha; of the perfected the Muni Kapila.
10:27:,"Uchchaishravas of horses know me, nectar-born; Airavata of lordly elephants, and among men the Monarch."
10:28:,Of weapons I am the thunderbolt; of cows I am Kamadhuk; I am Kandarpa of the progenitors; of serpents Vasuki am I.
10:29:,"And I am Ananta of Nagas, Varuna of sea-dwellers I; and of ancestors Aryaman; Yama of governors am I."
10:30:,And I am Prahlada of Daityas; of calculators Time am I; and of wild beasts the imperial beast; and Vainateya of birds.
10:31:,Of purifiers I am the wind; Rama of warriors I; and I am Makara of fishes; of streams the Ganga am I.
10:32:,"Of creations the beginning and the ending, and also the middle am I, O Arjuna. Of sciences the science concerning the Self; the speech of orators I."
10:33:,"Of letters the letter A I am, and the duality of a compound; I also everlasting Time; I the Supporter, whose face turns everywhere."
10:34:,"And all-devouring Death am I, and the origin of all to come; and of feminine qualities, fame, prosperity, speech, memory, intelligence, constancy, forgiveness."
10:35:,Of hymns also Brihatsaman; Gayatri of metres am I; of months I am Margashirsha; of seasons the flowery.
10:36:,"I am the gambling of the cheat, and the splendour of splendid things I; I am victory, I am determination, and the truth of the truthful I."
10:37:,Of the Vrishnis Vasudeva am I; of the Pandavas Dhananjaya; of the Sages also I am Vyasa; of poets Ushana the Bard.
10:38:,Of rulers I am the sceptre; of those that seek victory I am statesmanship; and of secrets I am also silence; the knowledge of knowers am I.
10:39:,"And whatsoever is the seed of all beings, that am I, O Arjuna; nor is there aught, moving or unmoving, that may exist bereft of Me."
10:40:,"There is no end of My divine powers, O Parantapa. What has been declared is illustrative of My infinite glory."
10:41:,"Whatsoever is glorious, good, beautiful, and mighty, understand thou that to go forth from a fragment of My splendour."
10:42:,"But what is the knowledge of all these details to thee, O Arjuna? Having pervaded this whole universe with one fragment of Myself, I remain."
11:1:,"Arjuna said: This word of the supreme Secret concerning the Self, Thou hast spoken out of compassion; by this my delusion is taken away."
11:2:,"The production and destruction of beings have been heard by me in detail from Thee, O Lotus-eyed, and also Thy imperishable greatness."
11:3:,"O supreme Lord, even as Thou describest Thyself, O best of beings, I desire to see Thy Form omnipotent."
11:4:,"If Thou thinkest that by me It can be seen, O Lord, Lord of Yoga, then show me Thine imperishable Self."
11:5:,"The Blessed Lord said: Behold, O Partha, a Form of Me, a hundredfold, a thousandfold, various in kind, divine, various in colours and shapes."
11:6:,"Behold the Adityas, the Vasus, the Rudras, the two Ashvins and also the Maruts; behold many marvels never seen ere this, O Bharata."
11:7:,"Here, to-day, behold the whole universe, movable and immovable, standing in one in My body, O Gudakesha, with aught else thou desirest to see."
11:8:,But verily thou art not able to behold Me with these thine eyes; the divine eye I give unto thee. Behold My sovereign Yoga.
11:9:,"Sanjaya said: Having thus spoken, O King, the great Lord of Yoga, Hari, showed to Partha His supreme Form as Lord."
11:10:,"With many mouths and eyes, with many visions of marvel, with many divine ornaments, with many upraised divine weapons;"
11:11:,"Wearing divine necklaces and vestures, anointed with divine unguents, the God all-marvellous, boundless, with face turned everywhere."
11:12:,"If the splendour of a thousand suns were to blaze out together in the sky, that might resemble the glory of that Mahatman."
11:13:,"There Pandava beheld the whole universe, divided into manifold parts, standing in one in the body of the Deity of Deities."
11:14:,"Then he, Dhananjaya, overwhelmed with astonishment, his hair upstanding, bowed down his head to the Shining One, and with joined palms spake."
11:15:,"Arjuna said: Within Thy Form, O God, the Gods I see, All grades of beings with distinctive marks; Brahma, the Lord, upon His lotus-throne, The Rishis all, and Serpents, the Divine."
11:16:,"With mouths, eyes, arms, breasts multitudinous, I see Thee everywhere, unbounded Form. Beginning, middle, end, nor source of Thee, Infinite Lord, infinite Form, I find;"
11:17:,"Shining, a mass of splendour everywhere, With discus, mace, tiara, I behold: Blazing as fire, as sun dazzling the gaze. From all sides in the sky, immeasurable."
11:18:,"Lofty beyond all thought, unperishing, Thou treasure-house supreme, all-immanent; Eternal Dharma’s changeless Guardian, Thou; As immemorial Man I think of Thee."
11:19:,"Nor source, nor midst, nor end; infinite force, Unnumbered arms, the sun and moon Thine eyes. I see Thy face, as sacrificial fire Blazing, its splendour burneth up the worlds."
11:20:,"By Thee alone are filled the earth, the heavens, And all the regions that are stretched between; The triple worlds sink down, O mighty One, Before Thine awful manifested Form."
11:21:,"To Thee the troops of Suras enter in, Some with joined palms in awe invoking Thee; Banded Maharshis, Siddhas, cry: ""All hail!"" Chanting Thy praises with resounding songs."
11:22:,"Rudras, Vasus, Sadhyas and Adityas, Vishvas, the Ashvins, Maruts, Ushmapas, Gandharvas, Yakshas, Siddhas, Asuras, In wondering multitudes beholding Thee."
11:23:,"Thy mighty Form, with many mouths and eyes, Long-armed, with thighs and feet innumerate, Vast-bosomed, set with many fearful teeth. The worlds see terror-struck, as also I."
11:24:,"Radiant, Thou touchest heaven, rainbow-hued, With opened mouths and shining vast-orbed eyes, My inmost self is quaking, having seen, My strength is withered, Vishnu, and my peace."
11:25:,"Like Time’s destroying flames I see Thy teeth, Upstanding, spread within expanded jaws; Nought know I anywhere, no shelter find. Mercy, O God! refuge of all the worlds!"
11:26:,"The sons of Dhritarashtra, and with them The multitude of all these kings of earth, Bhishma, and Drona, Suta’s royal son, And all the noblest warriors of our hosts,"
11:27:,"Into Thy gaping mouths they hurrying rush, Tremendous-toothed and terrible to see; Some caught within the gaps between Thy teeth Are seen, their heads to powder crushed and ground."
11:28:,"As river-floods impetuously rush, Hurling their waters into ocean’s lap, So fling themselves into Thy flaming mouths, In haste, these mighty men, these lords of earth."
11:29:,"As moths with quickened speed will headlong fly Into a flaming light, to fall destroyed, So also these, in haste precipitate, Enter within Thy mouths destroyed to fall."
11:30:,"On every side, all-swallowing, fiery-tongued, Thou lickest up mankind, devouring all; The glory filleth space: the universe Is burning, Vishnu, with Thy blazing rays."
11:31:,"Reveal Thy Self; what awful Form art Thou? I worship Thee! Have mercy, God supreme! Thine inner Being I am fain to know; This Thy forth-streaming Life bewilders me."
11:32:,"The Blessed Lord said: Time am I, laying desolate the world, Made manifest on earth to slay mankind! Not one of all these warriors ranged for strife Escapeth death; thou shalt alone survive."
11:33:,"Therefore stand up! win for thyself renown, Conquer thy foes, enjoy the wealth-filled realm. By Me they are already overcome. Be thou the outward cause, left-handed one."
11:34:,"Drona and Bhishma and Jayadratha, Karna, and all the other warriors here. Are slain by Me. Destroy them fearlessly. Fight! thou shalt crush thy rivals in the field."
11:35:,"Sanjaya said: Having heard these words of Keshava, he who weareth a diadem, with joined palms, quaking and prostrating himself, spake again to Krishna, stammering with fear, casting down his face."
11:36:,"Arjuna said: Hrishikesha! in Thy magnificence Rightly the world rejoiceth, hymning Thee; The Rakshasas to every quarter fly In fear; the hosts of Siddhas prostrate fall."
11:37:,"How should they otherwise, O loftiest Self! First Cause! Brahma Himself less great than Thou. Infinite, God of Gods, home of all worlds, Unperishing, Sat, Asat, That supreme!"
11:38:,"First of the Gods, most ancient Man Thou art, Supreme receptacle of all that lives; Knower and known, the dwelling-place on high; In Thy vast Form the universe is spread."
11:39:,"Thou art Vayu and Yama, Agni, moon, Varuna, Father, Grandsire of all; Hail, hail to Thee! a thousand times all hail! Hail unto Thee! again, again all hail!"
11:40:,"Prostrate in front of Thee, prostrate behind; Prostrate on every side to Thee, O All. In power boundless, measureless in strength, Thou holdest all: then Thou Thyself art All."
11:41:,"If, thinking Thee but friend, importunate, O Krishna! or O Yadava! O friend! I cried, unknowing of Thy majesty, And careless in the fondness of my love;"
11:42:,"If jesting, I irreverence showed to Thee, At play, reposing, sitting or at meals, Alone, O sinless One, or with my friends, Forgive my error, O Thou boundless One."
11:43:,"Father of worlds, of all that moves and stands, Worthier of reverence than the Guru’s self, There is none like to Thee. Who passeth Thee? Pre-eminent Thy power in all the worlds."
11:44:,"Therefore I fall before Thee; with my body I worship as it fitting; bless Thou me. As father with the son, as friend with friend, With the beloved as lover, bear with me."
11:45:,"I have seen that which none hath seen before. My heart is glad, yet faileth me for fear; Show me, O God, Thine other Form again — Mercy, O God of Gods, home of all worlds—"
11:46:,"Diademed, mace and discus in Thy hand. Again I fain would see Thee as before; Put on again Thy four-armed shape, O Lord, O thousand-armed, of forms innumerable."
11:47:,"The Blessed Lord said: Arjuna, by My favour thou hast seen, This loftiest Form by yoga’s self revealed! Radiant, all-penetrating, endless, first, That none except thyself hath ever seen."
11:48:,"Nor sacrifice, nor Vedas, alms, nor works, Nor sharp austerity, nor study deep. Can win the vision of this Form for man, Foremost of Kurus, thou alone hast seen."
11:49:,"Be not bewildered, be thou not afraid, Because thou hast beheld this awful Form; Cast fear away, and let thy heart rejoice; Behold again Mine own familiar shape."
11:50:,"Sanjaya said: Vasudeva, having thus spoken to Arjuna, again manifested His own Form, and consoled the terrified one, the Mahatman again assuming a gentle form."
11:51:,"Arjuna said: Beholding, again Thy gentle human Form, O Janardana, I am now collected, and am restored to my own nature."
11:52:,The Blessed Lord said: This Form of Mine beholden by thee is very hard to see. Verily the Shining Ones ever long to behold this form.
11:53:,"Nor can I be seen as thou hast seen Me by the Vedas, nor by austerities, nor by alms, or by offerings;"
11:54:,"But by devotion to Me alone I may thus be perceived, Arjuna, and known and seen in essence, and entered, O Parantapa."
11:55:,"He who doeth actions for Me, whose supreme good I am, My devotee, freed from attachment without hatred of any being, he cometh unto Me, O Pandava."
12:1:,"Arjuna said: Those devotees who ever harmonised worship Thee, and those also who worship the Indestructible, the Unmanifested, whether of these is the more learned in yoga?"
12:2:,"The Blessed Lord said: They who with mind fixed on Me ever harmonised worship Me, with faith supreme endowed, these, in My opinion, are best in yoga."
12:3:,"They who worship the Indestructible, the Ineffable, the Unmanifested, Omnipresent, and Unthinkable, the Unchanging, Immutable, Eternal,"
12:4:,"Restraining and subduing the senses, regarding everything equally, in the welfare of all rejoicing, these also come unto Me."
12:5:,The difficulty of those whose minds are set on the Unmanifested is greater; for the path of the Unmanifested is hard for the embodied to reach.
12:6:,"Those verily who, renouncing all actions in Me and intent on Me, worship meditating on Me, with whole-hearted yoga,"
12:7:,"These I speedily lift up from the ocean of death and existence, O Pârtha, their minds being fixed on Me."
12:8:,"Place thy mind in Me, into Me let thy Reason enter; then without doubt thou shalt abide in Me hereafter."
12:9:,"And if thou art not able firmly to fix thy mind on Me, then by the yoga of practice seek to reach Me, O Dhananjaya."
12:10:,"If also thou art not equal to constant practice, be intent on My service; performing actions for My sake, thou shalt attain perfection."
12:11:,"If even to do this thou hast not strength, then, taking refuge in union with Me, renounce all fruit of action with the self controlled."
12:12:,"Better indeed is wisdom than constant practice; than wisdom, meditation is better; than meditation, renunciation of the fruit of action; on renunciation follows peace."
12:13:,"He who beareth no ill-will to any being, friendly and compassionate, without attachment and egoism, balanced in pleasure and pain, and forgiving,"
12:14:,"Ever content, harmonious, with the self controlled, resolute, with mind and Reason dedicated to Me, he, My devotee, is dear to Me."
12:15:,"He from whom the world doth not shrink away, who doth not shrink away from the world, freed from the anxieties of joy, anger, and fear, he is dear to Me."
12:16:,"He who wants nothing, is pure, expert, passionless, untroubled, renouncing every undertaking, he, My devotee, is dear to Me."
12:17:,"He who neither loveth nor hateth, nor grieveth, nor desireth, renouncing good and evil, full of devotion, he is dear to Me."
12:18:,"Alike to foe and friend, and also in fame and ignominy, alike in cold and heat, pleasures and pains, destitute of attachment,"
12:19:,"Taking equally praise and reproach, silent, wholly content with what cometh, homeless, firm in mind, full of devotion, that man is dear to Me."
12:20:,"They verily who partake of this life-giving wisdom as taught herein, endued with faith, I their supreme Object, devotees, they are surpassingly dear to Me."
13:1:,"Arjuna said: Matter and Spirit, even the Field and the Knower of the Field, wisdom and that which ought to be known, these I fain would learn, O Keshava."
13:2:,"The Blessed Lord said: This body, son of Kuntî, is called the Field; that which knoweth it is called the Knower of the Field by the Sages."
13:3:,"Understand Me as the Knower of the Field in all Fields, O Bhârata. Wisdom as to the Field and the Knower of the Field, that in My opinion is the wisdom."
13:4:,"What that Field is and of what nature, how modified, and whence it is, and what He is and what His powers, hear that now briefly from Me."
13:5:,"Rishis have sung in manifold ways, in many various chants, and in decisive Brahma-sutra verses, full of reasonings."
13:6:,"The great Elements, Individuality, Reason and also the unmanifested, the ten senses and the one, and the five pastures of the senses;"
13:7:,"Desire, aversion, pleasure, pain, combination, intelligence, firmness; these, briefly described, constitute the Field and its modifications."
13:8:,"Humility, unpretentiousness, harmlessness, forgiveness, rectitude, service of the teacher, purity, steadfastness, self-control,"
13:9:,"Dispassion towards the objects of the senses, and also absence of egoism, insight into the pain and evil of birth, death, old age and sickness,"
13:10:,"Unattachment, absence of self-identification with son, wife or home, and constant balance of mind in wished-for and unwished-for events,"
13:11:,"Unflinching devotion to Me by yoga, without other objects, resort to sequestered places, absence of enjoyment in the company of men,"
13:12:,"Constancy in the wisdom of the Self, understanding of the object of essential wisdom; that is declared to be the Wisdom; all against it is ignorance."
13:13:,"I will declare that which ought to be known, that which being known immortality is enjoyed—the beginningless supreme Eternal, called neither being nor non-being."
13:14:,"Everywhere That hath hands and feet, everywhere eyes, heads, and mouths; all-hearing, He dwelleth in the world, enveloping all."
13:15:,Shining with all sense-faculties without any senses; unattached supporting everything and free from qualities enjoying qualities;
13:16:,"Without and within all beings, immovable and also movable; by reason of His subtlety imperceptible; at hand and far away is That."
13:17:,"Not divided amid beings, and yet seated distributively; that is to be known as the supporter of beings; He devours and He generates."
13:18:,"That, the Light of all lights, is said to be beyond darkness; Wisdom, the Object of Wisdom, by Wisdom to be reached, seated in the hearts of all."
13:19:,"Thus the Field, Wisdom and the Object of Wisdom, have been briefly told. My devotee, thus knowing, enters into My Being."
13:20:,Know thou that Matter and Spirit are both without beginning; and know thou also that modifications and qualities are all Matter-born.
13:21:,Matter is called the cause of the generation of causes and effects; Spirit is called the cause of the enjoyment of pleasure and pain.
13:22:,Spirit seated in Matter useth the qualities born of Matter; attachment to the qualities is the cause of his births in good and evil wombs.
13:23:,"Supervisor and permitter, supporter, enjoyer, the great Lord, and also the supreme Self; thus is styled in this body the supreme Spirit."
13:24:,"He who thus knoweth Spirit and Matter with its qualities, in whatsoever condition he may be, he shall not be born again."
13:25:,"Some by meditation behold the Self in the self by the Self; others by the Sânkhya Yoga, and others by the Yoga of Action;"
13:26:,"Others also, ignorant of this, having heard of it from others, worship; and these also cross beyond death, adhering to what they had heard."
13:27:,"Whatsoever creature is born, immobile or mobile, know thou, O best of the Bharatas, that it is from the union between the Field and the Knower of the Field."
13:28:,"Seated equally in all beings, the supreme Lord, unperishing within the perishing—he who thus seeth, he seeth."
13:29:,"Seeing indeed everywhere the same Lord equally dwelling, he doth not destroy the Self, and thus treads the highest Path."
13:30:,"He who seeth that Matter verily performeth all actions, and that the Self is actionless, he seeth."
13:31:,"When he perceiveth the diversified existence of beings as rooted in One, and spreading forth from it, then he reacheth the Eternal."
13:32:,"Being beginningless and without qualities, the imperishable supreme Self, though seated in the body, O Kaunteya, worketh not nor is affected."
13:33:,"As the omnipresent ether is not affected, by reason of its subtlety, so seated everywhere in the body the Self is not affected."
13:34:,"As the one sun illumineth the whole earth, so the Lord of the Field illumineth the whole Field, O Bhârata."
