verse_no,verse
4:18:,"He who seeth inaction in action, and action in inaction, he is wise among men, he is harmonious, even while performing all action."
4:19:,"Whose works are all free from the moulding of desire, whose actions are burned up by the fire of wisdom, him the wise have called a Sage."
4:20:,"Having abandoned attachment to the fruit of action, always content, nowhere seeking refuge, he is not doing anything, although doing actions."
4:21:,"Hoping for naught, his mind and self controlled, having abandoned all greed, performing action by the body alone, he doth not commit sin."
4:22:,"Content with whatsoever he obtaineth without effort, free from the pairs of opposites, without envy, balanced in success and failure, though acting he is not bound."
4:23:,"Of one with attachment dead, harmonious, with his thoughts established in wisdom, his works sacrifices, all action melts away."
4:24:,"The ETERNAL the oblation, the ETERNAL the clarified butter, are offered in the ETERNAL the fire by the ETERNAL; unto the ETERNAL verily shall he go who in his action meditateth wholly upon the ETERNAL."
4:25:,Some Yogis offer up sacrifice to the Shining Ones; others sacrifice only by pouring sacrifice into the fire of the ETERNAL;
4:26:,Some pour as sacrifice hearing and the other senses into the fires of restraint; some pour sound and the other objects of sense into the fires of the senses as sacrifice;
4:27:,"Others again into the wisdom-kindled fire of union attained by self-control, pour as sacrifice all the functions of the senses and the functions of life;"
4:28:,"Yet others the sacrifice of wealth, the sacrifice of austerity, the sacrifice of yoga, the sacrifice of silent reading and wisdom, men concentrated and of effectual vows;"
4:29:,"Yet others pour as sacrifice the outgoing breath in the incoming, and the incoming, in the outgoing, restraining the flow of the outgoing and incoming breaths, solely absorbed in the control of breathing."
4:30:,"Others regular in food, pour as sacrifice their life breaths in life breaths. All these are knowers of sacrifice, and by sacrifice have destroyed their sins."
4:31:,"The eaters of the life-giving remains of sacrifice go to the changeless ETERNAL, This world is not for the non-sacrificer, much less the other, O best of the Kurus."
4:32:,"Many and various sacrifices are thus spread out before the ETERNAL. Know thou that all these are born of action, and thus knowing thou shalt be free."
4:33:,"Better than the sacrifice of any objects is the sacrifice of wisdom, O Parantapa. All actions in their entirety, O Pârtha, culminate in wisdom."
4:34:,"Learn thou this by discipleship, by investigation, and by service. The wise, the seers of the essence of things, will instruct thee in wisdom."
4:35:,"And having known this, thou shalt not again fall into this confusion, O Pandava; for by this thou wilt see all beings without exception in the SELF, and thus in Me."
4:36:,"Even if thou art the most sinful of all sinners, yet shalt thou cross over all sin by the raft of wisdom."
4:37:,"As the burning fire reduces fuel to ashes, O Arjuna, so doth the fire of wisdom reduce all actions to ashes."
4:38:,Verily there is no purifier in this world like wisdom; he that is perfected in yoga finds it in the SELF in due season.
4:39:,"The man who is full of faith obtaineth wisdom, and he also who hath mastery over his senses; and, having obtained wisdom, he goeth swiftly to the supreme Peace."
4:40:,"But the ignorant, faithless, doubting self goeth to destruction; nor this world, nor that beyond, nor happiness, is there for the doubting self."
4:41:,"He who hath renounced actions by yoga, who hath cloven asunder doubt by wisdom, who is ruled by the SELF, actions do not bind him, O Dhananjaya."
4:42:,"Therefore, with the sword of the wisdom of the SELF cleaving asunder this ignorance-born doubt dwelling in thy heart, be established in yoga. Stand up, O Bharata."
5:1:,"Arjuna said: Renunciation of actions Thou praisest, O Krishna, and then also yoga. Of the two which one is the better? That tell me conclusively."
5:2:,"The Blessed Lord said: Renunciation and yoga by action both lead to the highest bliss; of the two, yoga by action is verily better than renunciation of action."
5:3:,"He should be known as a perpetual ascetic, who neither hateth nor desireth; free from the pairs of opposites, O mighty-armed, he is easily set free from bondage."
5:4:,"Children, not Sages, speak of the Sankhya and the Yoga as different; he who is duly established in one obtaineth the fruits of both."
5:5:,"That place which is gained by the Sankhyas is reached by the Yogîs also. He seeth, who seeth that the Sankhya and the Yoga are one."
5:6:,"But without yoga, O mighty-armed, renunciation is hard to attain to; the yoga-harmonised Muni swiftly goeth to the ETERNAL."
5:7:,"He who is harmonised by yoga, the self-purified, SELF-ruled, the senses subdued, whose SELF is the SELF of all being, although acting he is not affected."
5:8 & 5:9:," ""I do not anything,"" should think the harmonised one, who knoweth the essence of things seeing, hearing, touching, smelling, eating moving, sleeping, breathing. Speaking, giving, grasping, opening and closing the eyes, he holdeth: ""The senses move among the objects of the senses."""
5:10:,"He who acteth, placing all actions in the ETERNAL, abandoning attachment, is unaffected by sin as a lotus leaf by the waters."
5:11:,"Yogis, having abandoned attachment, perform action only by the body, by the mind, by the Reason, and even by the senses, for the purification of the self."
5:12:,"The harmonised man, having abandoned the fruit of action, attaineth to the eternal Peace; the non-harmonised, impelled by desire, attached to fruit, are bound."
5:13:,"Mentally renouncing all actions, the sovereign dweller in the body resteth serenely in the nine-gated city, neither acting nor causing to act."
5:14:,"The Lord of the world produceth not the idea of agency, nor actions, nor the union together of action and its fruit; nature, however, manifesteth."
5:15:,The Lord accepteth neither the evil-doing nor yet the well-doing of any. Wisdom is enveloped by unwisdom; therewith mortals are deluded.
5:16:,"Verily, in whom unwisdom is destroyed by the wisdom of the SELF, in them wisdom, shining as the sun, reveals the Supreme."
5:17:,"Thinking on THAT, merged in THAT, established in THAT, solely devoted to THAT, they go whence there is no return, their sins dispelled by wisdom."
5:18:,"Sages look equally on a Brahmana adorned with learning and humility, a cow, an elephant, and even a dog and an outcaste."
5:19:,Even here on earth everything is overcome by those whose mind remains balanced; the ETERNAL is incorruptible and balanced; therefore they are established in the ETERNAL.
5:20:,"With Reason firm, unperplexed, the knower of the ETERNAL established in the ETERNAL, neither rejoiceth on obtaining what is pleasant, nor sorroweth on obtaining what is unpleasant."
5:21:,"He, whose self is unattached to external contacts and findeth joy in the SELF, having the self harmonised with the ETERNAL by yoga, enjoys imperishable bliss."
5:22:,"The delights that are contact-born, they are verily wombs of pain, for they have beginning and ending, O Kaunteya; not in them may rejoice the wise."
5:23:,"He who is able to endure here on earth, ere he be liberated from the body, the force born from desire and passion, he is harmonised, he is a happy man."
5:24:,"He who is happy within, who rejoiceth within, who is illuminated within, that Yogî, becoming the ETERNAL, goeth to the Peace of the ETERNAL."
5:25:,"Rishis, their sins destroyed, their duality removed, their selves controlled, intent upon the welfare of all beings, obtain the Peace of the ETERNAL."
5:26:,"The Peace of the ETERNAL lies near to those who know themselves, who are disjoined from desire and passion, subdued in nature, of subdued thoughts."
5:27 & 5:28:," Having external contacts excluded, and with gaze fixed between the eyebrows; having made equal the outgoing and ingoing breaths moving within the nostrils; With senses, mind, and Reason ever controlled, solely pursuing liberation, the Sage, having for ever cast away desire, fear and passion, verily is liberated."
5:29:,"Having known Me, as the Enjoyer of sacrifice and of austerity, the mighty Ruler of all the worlds, and the Lover of all beings, he goeth to Peace."
6:1:,"The Blessed Lord said: He that performeth such action as is duty, independently of the fruit of action, he is an ascetic, he is a Yogî, not he that is without fire, and without rites."
6:2:,"That which is called renunciation know thou that as yoga, O Pandava; nor doth any one be-come a Yogî with the formative will unrenounc-ed."
6:3:,"For a Sage who is seeking Yoga, action is call-ed the means; for the same Sage, when he is enthroned in yoga, serenity is called the means."
6:4:,"When a man feeleth no attachment either for the objects of sense or for actions, renouncing the formative will, then, he is said to be enthroned in yoga."
6:5:,"Let him raise the self by the SELF and not let the self become depressed; for verily is the SELF the friend of the self, and also the SELF the self's enemy;"
6:6:,The SELF is the friend of the self of him in whom the self by the SELF is vanquished; but to the unsubdued self the SELF verily becometh hostile as an enemy.
6:7:,"The higher Self of him who is SELF-controlled and peaceful is uniform in cold and heat, pleasure and pain, as well as in honour and dishonour."
6:8:,"The Yogî who is satisfied with wisdom and knowledge, unwavering, whose senses are sub-dued, to whom a lump of earth, a stone and gold are the same, is said to be harmonised."
6:9:,"He who regards impartially lovers, friends, and foes, strangers, neutrals, foreigners and relatives, also the righteous and unrighteous, he excelleth."
6:10:,"Let the Yogî constantly engage himself in yoga, remaining in a secret place by himself, with thought and self subdued, free from hope and greed."
6:11:,"In a pure place, established on a fixed seat of his own, neither very much raised nor very low, made of a cloth, a black antelope skin, and kusha grass, one over the other;"
6:12:,"There, having made the mind one-pointed, with thought and the functions of the senses subdued, steady on his seat, he should practise yoga for the purification of the self."
6:13:,"Holding the body, head, and neck erect, im-movably steady, looking fixedly at the point of the nose, with unseeing gaze,"
6:14:,"The self serene, fearless, firm in the vow of the Brahmacharî, the mind controlled, thinking on Me, harmonised, let him sit aspiring after Me."
6:15:,"The Yogî ever united thus with the SELF, with the mind controlled, goeth to Peace, to the supreme Bliss that abideth in Me."
6:16:,"Verily yoga is not for him who eateth too much, nor who abstaineth to excess, nor who is too much addicted to sleep, nor even to wakeful-ness, O Arjuna."
6:17:,"Yoga killeth out all pain for him who is regulated in eating and amusement, regulated in performing actions, regulated in sleeping and waking."
6:18:,"When his subdued thought is fixed on the SELF, free from longing after all desirable things, then it is said, ""he is harmonised."""
6:19:,"As a lamp in a windless place flickereth not, to such is likened the Yogî of subdued thought, absorbed in the yoga of the SELF."
6:20:,"That in which the mind finds rest, quieted by the practice of yoga: that in which he, seeing the SELF by the SELF, in the SELF is satisfied;"
6:21:,"That in which he findeth the supreme delight which the Reason can grasp beyond the senses, wherein established he moveth not from the Reality;"
6:22:,"Which, having obtained, he thinketh there is no greater gain beyond it; wherein, established, he is not shaken even by heavy sorrow;"
6:23:," That should be known by the name of yoga, this disconnection from the union with pain. This yoga must be clung to with a firm convic-tion and with undesponding mind."
6:24:,"Abandoning without reserve all desires born of the imagination, by the mind curbing in the aggregate of the senses on every side,"
6:25:,"Little by little let him gain tranquillity, by means of Reason controlled by steadiness; having made the mind abide in the SELF, let him not think of anything."
6:26:,"As often as the wavering and unsteady mind goeth forth, so often reining it in, let him bring it under the control of the SELF."
6:27:,"Supreme joy is for this Yogî whose mind is peaceful, whose passion-nature is calmed, who is sinless and of the nature of the ETERNAL."
6:28:,"The Yogî who thus, ever harmonising the self, hath put away sin, he easily enjoyeth the infinite bliss of contact with the ETERNAL."
6:29:,"The self, harmonised by yoga, seeth the SELF abiding in all beings, all beings in the SELF; everywhere he seeth the same."
6:30:," He who seeth Me everywhere, and seeth every-thing in Me, of him will I never lose hold, and he shall never lose hold of Me."
6:31:,"He who, established in unity, worshippeth Me, abiding in all beings, that Yogî liveth in Me, whatever his mode of living."
6:32:,"He who, through the likeness of the SELF O Arjuna, seeth equality in everthing, whether pleasant or painful, he is considered a perfect Yogi."
6:33:,"Arjuna said: This yoga which Thou hast declared to be by equanimity, O Madhusudana. I see not a stable foundation for it, owing to restlessness;"
6:34:,"For the mind is verily, restless, O Krishna; it is impetuous, strong and difficult to bend. I deem it as hard to curb as the wind."
6:35:,"The Blessed Lord said: Without doubt, O mighty-armed, the mind is hard to curb and restless; but it may be curbed by constant practice and by dispassion."
6:36:,"Yoga is hard to attain, methinks, by a self that is uncontrolled; but by the SELF-controlled it is attainable by properly directed energy."
6:37:,"Arjuna said: He who is unsubdued but who possesseth faith, with the mind wandering away from yoga, fail-ing to attain perfection in yoga, what path doth he tread, O Krishna?"
6:38:,"Fallen from both, is he destroyed like a rent cloud, unsteadfast, O mighty-armed, deluded in the path of the ETERNAL?"
6:39:,"Deign, O Krishna, to completely dispel this doubt of mine; for there is none to be found save Thyself able to destroy this doubt."
6:40:,"The Blessed Lord said: O son of Pritha, neither in this world nor in the life to come is there destruction for him; never doth any who worketh righteousness, O beloved, tread the path of woe."
6:41:,"Having attained to the worlds of the pure-doing, and having dwelt there for immemorial years, he who fell frona yoga is reborn in a pure and bless-ed house;"
6:42:,Or he may even be born into a family of wise Yogîs; but such a birth as that is most difficult to obtain in this world.
6:43:,"There he recovereth the characteristics belonging to his former body, and with these again laboureth for perfection, O joy of the Kurus! "
6:44:,"By that former practice he is irresistibly swept away. Only wishing to know Yoga, even the seeker after Yoga goeth beyond the Brahmic word, "
6:45:,"But the Yogî, labouring with assiduity, purified from sin, fully perfected through manifold births, he reacheth the supreme goal. "
6:46:,"The Yogî is greater than the ascetics; he is thought to be greater than even the wise; the Yogî is greater than the men of action; therefore become thou a Yogî, O Arjuna! "
6:47:,"And among all Yogîs, he who full of faith, with the inner SELF abiding in Me, adoreth Me, he is considered by Me to be the most completely harmonised. "
7:1:,"With Manas clinging to Me, O Pârtha performing Yoga, refuged in Me, how thou shalt without doubt know Me to the uttermost, that hear thou. "
7:2:,"I will declare to thee this knowledge and wisdom in its completeness, which, having known, there is nothing more here remaineth to be known. "
7:3:,Among thousands of men scarce one striveth for perfection; of the successful strivers scarce one knoweth Me in essence.
7:4:,"Earth, water, fire, air, ether, Manas and Buddhi also and Ahankara-these are the eightfold division of My Prakriti- "
7:5:,"This the inferior. Know My other Prakriti, the higher, the life-element, O mighty-armed, by which the universe is upheld. "
7:6:,Know this to be the womb of all beings. I am the source of the forthgoing of the whole universe and likewise the place of its dissolving.
7:7:,"There is naught whatsoever higher than I, O Dhananjaya. All this is threaded on Me, as rows of pearls on a string."
7:8:,"I the sapidity in waters, O son of Kuntî, I the radiance in moon and sun; the Word of Power in all the Vedas, sound in ether, and virility in men;"
7:9:,"The pure fragrance of earths and the brilliance in fire am I; the life in all beings am I, and the austerity in ascetics."
7:10:,"Know Me, O Pârtha! as the eternal seed of all beings. I am the Reason of the Reason-endowed, the splendour of splendid things am I."
7:11:,"And I the strength of the strong, devoid of desire and passion. In beings I am desire not contrary to duty, O Lord of the Bharatas."
7:12:,"The natures that are harmonious, active, slothful, these know as from Me; not I in them, but they in Me."
7:13:,"All this world, deluded by these natures made by the three qualities, knoweth not Me, above these, imperishable."
7:14:,"This divine illusion of Mine, caused by the qualities, is hard to pierce; they who come to Me, they cross over this illusion."
7:15:,"The evil-doing, the deluded, the vilest men, they come not to Me, they whose wisdom is destroyed by illusion, who have embraced the nature of demons."
7:16:,"Fourfold in division are the righteous ones who worship me, O Arjuna the suffering, the seeker for knowledge, the self-interested and the wise, O Lord of the Bharatas."
7:17:,"Of these the wise constantly harmonised, worshipping the One, is the best; I am supremely dear to the wise, and he is dear to Me."
7:18:,"Noble are all these, but I hold the wise as verily Myself he, SELF-united, is fixed on Me, the highest Path."
7:19:,"At the close of many births the man full of wisdom cometh unto Me; ""Vasudeva is all,"" saith he, the Mahatmâ, very difficult to find."
7:20:,"They whose wisdom hath been rent away by desires go forth to other Shining Ones, resorting to various external observances, according to their own natures."
7:21:,"Any devotee who seeketh to worship with faith any such aspect, I verily bestow the unswerving faith of that man."
7:22:,"He endowed with that faith, seeketh the worship of such a one, and from him he obtaineth his desires, I verily decreeing the benefits;"
7:23:,"Finite indeed the fruit, that belongeth to those who are of small intelligence. To the Shining Ones go the worshippers of the Shining Ones, but my devotees come unto Me."
7:24:,"Those devoid of Reason think of Me, the unmanifest, as having manifestation, knowing not My supreme nature, imperishable, most excellent."
7:25:,"Nor am I of all discovered, enveloped in My creation-illusion. This deluded world knoweth Me not, the unborn, the imperishable."
7:26:,"I know the beings that are past, that are present, that are to come, O Arjuna, but no one knoweth Me."
7:27:,"By the delusion of the pairs of opposites, sprung from attraction and repulsion, O Bharata, all beings walk this universe wholly deluded, O Parantapa."
7:28:,"But those men of pure deeds, in whom sin is come to an end, they, freed from the delusive pairs of opposites, worship Me, steadfast in vows."
7:29:,"They who, refuged in Me, strive for liberation from birth and death, they know the Eternal, the whole SELF-knowledge, and all action."
7:30:,"They who know Me as the knowledge of the elements, as that of the Shining Ones, and as that of the Sacrifice, they harmonised in mind know Me verily even in the time of forthgoing."
8:1:,"Arjuna said: What is that Eternal, what Self-knowledge, what Action, O Purushottama? And what is declared to be the knowledge of the Elements, what is called the knowledge of the Shining Ones?"
8:2:,"What is the knowledge of Sacrifice in this body, and how, O Madhusudana? And how, at the time of forthgoing art Thou known by the SELF-controlled?"
8:3:,"The Blessed Lord said: The indestructible, the supreme is the Eternal; His essential nature is called Self-knowledge; the emanation that causes the birth of beings is named Action;"
8:4:,"Knowledge of the Elements concerns My perishable nature, and knowledge of the Shining Ones concerns the life-giving energy; the knowledge of Sacrifice tells of Me, as wearing the body, O best of living beings."
8:5:,"And he who, casting off the body, goeth forth thinking upon Me only at the time of the end, he entereth into My being: there is no doubt of that."
8:6:,"Whosoever at the end abandoneth the body, thinking upon any being, to that being only he goeth, O Kaunteya, ever to that conformed in nature."
8:7:,"Therefore at all times think upon Me only and fight. With mind and Reason set on Me, without doubt thou shalt come to Me."
8:8:,"With the mind not wandering after aught else, harmonised by continual practice, constantly meditating, O Pârtha, one goeth to the Spirit supreme, divine."
8:9:,"He who thinketh upon the Ancient, the Omniscient, the All-Ruler, minuter than the minute, the supporter of all, of form unimaginable, refulgent as the sun beyond the darkness,"
8:10:,"In the time of forthgoing, with unshaken Manas, fixed in devotion, by the power of Yoga drawing together his life-breath in the centre of the two eyebrows, he goeth to this Purusha, supreme, divine. "
8:11:,"That which is declared indestructible by the Veda-knowers, that which the controlled and passion-free enter, that desiring which Brahmacharya is performed, that path I will declare to thee with brevity. "
8:12:,"All the gates closed, Manas confined in the heart, the life-breath fixed in his own head, firm in Yoga, "
8:13:,"""Om!"" the one-syllabled Brahman, reciting, thinking upon Me, he who goeth forth, abandoning the body, he goeth to the highest goal. "
8:14:,"He who constantly thinketh upon Me, not thinking ever of another, of him I am easily reached, O Pârtha, of this ever harmonised Yogî. "
8:15:,"Having come to Me, these Mahâtmâs come not again to birth, the place of pain, non-eternal; they have gone to the highest bliss. "
8:16:,"The worlds, beginning with the world of Brahma, they come and go, O Arjuna; but he who cometh unto Me, O Kaunteya, he knoweth birth no more."
8:17:,"The people who know the day of Brahma, a thousand ages in duration, and the night, a thousand ages in ending, they know day and night."
8:18:,"From the unmanifested all the manifested stream forth at the coming of day; at the coming of night they dissolve, even in That called the unmanifested."
8:19:,"This multitude of beings, going forth repeatedly, is dissolved at the coming of night: by ordination, O Pârtha, it streams forth at the coming of day."
8:20:,"Therefore verily there existeth, higher than that unmanifested, another unmanifested, eternal, which, in the destroying of all beings, is not destroyed."
8:21:,"That unmanifested, ""the Indestructible,"" It is called; It is named the highest Path. They who reach It return not. That is My supreme abode."
8:22:,"He, the highest Spirit, O Pârtha, may be reached by unswerving devotion to Him alone, in whom all beings abide, by whom all This is pervaded."
8:23:,"That time wherein going forth Yogis return not, and also that wherein going forth they return, that time shall I declare to thee, O prince of the Bharatas."
8:24:,"Fire, light, day-time, the bright fortnight, the six months of the northern path—then, going forth, the men who know the Eternal go to the Eternal."
8:25:,"Smoke, night-time, the dark fortnight also, the six months of the southern path—then the Yogi, obtaining the moonlight, returneth."
8:26:,"Light and darkness, these are thought to be the world's everlasting paths; by the one he goeth who returneth not, by the other he who returneth again."
8:27:,"Knowing these paths, O Pârtha, the Yogi is nowise perplexed. Therefore in all times be firm in yoga, O Arjuna."
8:28:,"The fruit of meritorious deeds, attached in the Vedas to sacrifices, to austerities, and also to almsgiving, the Yogi passeth all these by having known this, and goeth to the supreme and ancient Seat."
9:1:,"The Blessed Lord said: To thee, the uncarping, verily shall I declare this profoundest Secret, wisdom with knowledge combined, which, having known, thou shalt be freed from evil."
9:2:,"Kingly Science, kingly Secret, supreme Purifier, this; intuitional, according to righteousness, very easy to perform, imperishable."
9:3:,"Men without faith in this knowledge, O Parantapa, not reaching Me, return to the path of this world of death."
9:4:,"By Me all this world is pervaded in My unmanifested aspect; all beings have root in Me, I am not rooted in them."
9:5:,"Nor have beings root in Me; behold My sovereign Yoga! The support of beings, yet not rooted in beings, My Self their efficient cause."
9:6:,"As the mighty air everywhere moving is rooted in the ether, so all beings rest rooted in Me — thus know thou."
9:7:,"All beings, O Kaunteya, enter my lower nature at the end of a world-age; at the beginning of a world-age again I emanate them."
9:8:,"Hidden in Nature, which is mine own, I emanate again and again all this multitude of beings, helpless, by the force of Nature."
9:9:,"Nor do these works bind me, O Dhananjaya, enthroned on high, unattached to actions."
9:10:,"Under Me as supervisor, Nature sends forth the moving and unmoving: because of this, O Kaunteya, the universe revolves."
9:11:,"The foolish disregard Me, when clad in human semblance, ignorant of My supreme nature, the great Lord of beings;"
9:12:,"Empty of hope, empty of deeds, empty of wisdom, senseless, partaking of the deceitful, brutal and demoniacal nature."
